url,title,content,reply
https://cafe.naver.com/imsanbu?iframe_url=%2FArticleRead.nhn%3Fclubid%3D10094499%26articleid%3D74332715%26art%3DaW50ZXJuYWwtY2FmZS13ZWItc2VjdGlvbi1zZWFyY2gtbGlzdA.eyJ0eXAiOiJKV1QiLCJhbGciOiJIUzI1NiJ9.eyJjYWZlVHlwZSI6IkNBRkVfVVJMIiwiYXJ0aWNsZUlkIjo3NDMzMjcxNSwiY2FmZVVybCI6Imltc2FuYnUiLCJpc3N1ZWRBdCI6MTc0NDM1ODM1MjUyMn0.wq9-tr0Aw_Uy3E4bQ-PomoVxR5TsUJaBtqrElgaBW6Q%26query%3D%25EC%2595%2584%25EC%259D%25B4%25EB%258F%258C%25EB%25B4%2584%25EC%2584%259C%25EB%25B9%2584%25EC%258A%25A4,어린이집 vs 아이돌봄서비스 17개월 아가 적응 질문이요!!,"아기는 17개월이구요. 제가 3월부터 학교를 주1회 가야해서 그날은 거의 밤11시에 올 것 같고, 그날은 남편이랑 할머니가 봐주시기로 했는데요. 워낙 할머니는 좋아하긴 하는데 문제는 어린이집 적응하다가 그마저도 엄마 집착이 생길까 싶어요.이정도면 좀 큰거 같아서 어린이집 적응한다고 이틀 보내봤는데 어휴.. 꺼억꺼억 울어서 너무 마음아프고 더 엄마 집착하더라구요. 언니오빠들을 좋아해서 그 안이 궁금은 한데, (안에서 오빠들 북치는거 볼때는 안울고 관찰했다네요) 엄마랑 떨어지는게 힘든거같아요. 넘 마음아픔 ㅠ ㅠ .. 그리구 원래 엄청 조심스럽고 무서운게 많은 아가에요. 호기심은 많지만 .. 어린이집 적응은 원래 오래걸리는 것 같구 글 찾아보니 들어갈때는 계속 울기도 하는거같구 ; 또 어린이집이 엄마가 같이 못들어가요. 애기가 그래도 좀 적응하면 타인과도 잘 있는데 아예 첨보는 샘한테 넘겨버리니까 ㅠㅠ ,,,, 방침이 아쉽긴한데 또 집 바로앞인 점이 좋아서,, ㅜㅜ 아이가 다른 어린이집 상담갔을때 어린이집 아가들 많은거 보구 나 여기서 놀래 라고 표현했었거든요 ;; 근데 엄마랑 떨어지는건 싫겠죠 ㅜㅜ 늦게 보내는걸 추천하는 글도 많이보여서요. 원랜 무조건 어린이집 보내서 좀 나머지 시간 공부도하고 내 시간도 보내려했는데 또 마음이 이래저래 바뀌는거같아요.아이가 밥도 잘 안먹어서,, 제가 요리도 잘 못하고 해서 가서 식습관 잡고 오전만이라두 있다오게 하려했는데;;일단 지금 아이돌봄서비스 이용하는데 너무 좋은 샘 만나서.. 돌봄샘으로 오전 봐주시게 하고 최대한 버티는 방법도 있거든요...ㅜㅜ  제가 공부를 나가서 하던지 하고;;어떤게 더 나아보일까요? 조언 마구마구 주세요.. 그리고 두돌 지나서 보내도 들어갈때 아가는 우나요?? ㅜㅜ","돌봄이요., 어린이집은 다대다라 케어가 힘들어요ㅜ"
https://cafe.naver.com/cafe1535?iframe_url=%2FArticleRead.nhn%3Fclubid%3D22243426%26articleid%3D1526473%26art%3DaW50ZXJuYWwtY2FmZS13ZWItc2VjdGlvbi1zZWFyY2gtbGlzdA.eyJ0eXAiOiJKV1QiLCJhbGciOiJIUzI1NiJ9.eyJjYWZlVHlwZSI6IkNBRkVfVVJMIiwiYXJ0aWNsZUlkIjoxNTI2NDczLCJjYWZlVXJsIjoiY2FmZTE1MzUiLCJpc3N1ZWRBdCI6MTc0NDM1ODM1MjUyM30.aD_foUp8eVVs1hRaeB-8VFa3HBXuSWERRw3hhE30AWE%26query%3D%25EC%2595%2584%25EC%259D%25B4%25EB%258F%258C%25EB%25B4%2584%25EC%2584%259C%25EB%25B9%2584%25EC%258A%25A4,아이돌봄서비스,"- 가구원수 = 명- 부양의무자 =- 재산(금융&일반,부동산) = 만원- 소득(양육비포함) = 만원/월- 소득발생자 나이 =- 부채 =  만원- 자동차(배기량,연식,차량가액 등) =- 거주지역[1급지(서울)/2급지(경기)/3급지(광역·세종·창원)/4급지(그 외 지역) =- 현재 받고 있는 복지 또는 신청하려는 복지 =차상위한부모예요아이돌봄서비스는 사대보험안들어가면이용못하나요.",댓글 없음
https://cafe.naver.com/dgmom365?iframe_url=%2FArticleRead.nhn%3Fclubid%3D24000254%26articleid%3D6946272%26art%3DaW50ZXJuYWwtY2FmZS13ZWItc2VjdGlvbi1zZWFyY2gtbGlzdA.eyJ0eXAiOiJKV1QiLCJhbGciOiJIUzI1NiJ9.eyJjYWZlVHlwZSI6IkNBRkVfVVJMIiwiYXJ0aWNsZUlkIjo2OTQ2MjcyLCJjYWZlVXJsIjoiZGdtb20zNjUiLCJpc3N1ZWRBdCI6MTc0NDM1ODM1MjUyNH0.DGdqIF4O0pjRo0O8-sEKC90KD-VGnnH7u_16PpQRq6g%26query%3D%25EC%2595%2584%25EC%259D%25B4%25EB%258F%258C%25EB%25B4%2584%25EC%2584%259C%25EB%25B9%2584%25EC%258A%25A4,2025년 아이돌봄서비스 ! 이렇게 달라집니다,2025년 아이돌봄서비스 이렇게 달라집니다!💡✨ 촘촘한 돌봄 지원으로 보호자들의 육아 부담을 덜어드립니다.👶​✅ 정부지원 대상 확대 및 지원비율 상향✅ 이른둥이·경증 장애 손자녀 돌봄 혜택 강화✅ 긴급돌봄서비스 부담 완화✅ 아이돌보미 근무환경 개선​💬 여성가족부가 육아 걱정 없는 사회를 만들어 갑니다!✍️ 신청방법 : 1577-2514 / 검색창에 '아이돌봄서비스' 검색 / ‘아이돌봄서비스’ 앱​​#기부하go#행복나누go#가정살리go#칭찬해yo#함께해yo#가정복지회#아이돌봄지원사업#아이돌보미#대구아이돌봄광역지원센터#한국건강가정진흥원#여성가족부,유용한 정보 감사합니다:)
https://cafe.naver.com/imsanbu?iframe_url=%2FArticleRead.nhn%3Fclubid%3D10094499%26articleid%3D73788167%26art%3DaW50ZXJuYWwtY2FmZS13ZWItc2VjdGlvbi1zZWFyY2gtbGlzdA.eyJ0eXAiOiJKV1QiLCJhbGciOiJIUzI1NiJ9.eyJjYWZlVHlwZSI6IkNBRkVfVVJMIiwiYXJ0aWNsZUlkIjo3Mzc4ODE2NywiY2FmZVVybCI6Imltc2FuYnUiLCJpc3N1ZWRBdCI6MTc0NDM1ODM1MjUyNn0.yhUlLaY6Nu_E8ocsQYh0e8coLbc7BGJpU-Iov6r0iog%26query%3D%25EC%2595%2584%25EC%259D%25B4%25EB%258F%258C%25EB%25B4%2584%25EC%2584%259C%25EB%25B9%2584%25EC%258A%25A4,15개월 여아 아이돌봄서비스 vs 어린이집,​현재 맞벌이 중인데 아이돌봄 서비스 9시부터 6시까지 종일제로 이용중입니다.​선생님 애기 잘 돌봐주시고 만족스럽긴 한데​25년 3월부터(17개월차) 어린이집 입소가능하다는 연락이 여러군데와서 고민하고 있어요​여아인데 활발하고 새로운 자극을 좋아하는 편입니다.집에서 보육하면 너무 단조로울까 걱정되서요​일하는 엄마 입장에서는어린이집보다 챙겨줄게 없고신경 덜쓰이는 아이돌봄서비스가 더 편한데과연 아이에게도 최선일까 고민됩니다.​정부지원도 일부 받고 있어서경제적인 면보다는 보육의 질적인 면에서 어떨지가...​만1세라 아직 대인관계 형성도 안될테고잘먹이고 씻기고 놀아주는게 전부인데어린이집은 아무래도 1대 여러명 아이 케어를 하니아이돌봄 1대1이 좋을까요아니면 선생님과 또래 친구들이 있는 환경에서 보고 배우는게 더 많을까요​경험있으신 엄마들의 현실적인 댓글 부탁드립니다!읽어주셔서 감사합니다~,"월급에 큰 지장없으시면 전 얼집 추천이요. 단점은 진짜 매일 아프다는거...이거 하나구요15갤이면 나 말고 다른 또래 친구들 알아볼거에요즤 아기 7갤에 얼집가서 자기보다 7갤빠른 친구 돌지나고 보이는지그 때부터 등원할 때 놀이터에서,얼집에서 같이 어울려 놀더라구요.그리고 확실히 뭔가 배우는 것도 빨라요"
https://cafe.naver.com/imsanbu?iframe_url=%2FArticleRead.nhn%3Fclubid%3D10094499%26articleid%3D74579028%26art%3DaW50ZXJuYWwtY2FmZS13ZWItc2VjdGlvbi1zZWFyY2gtbGlzdA.eyJ0eXAiOiJKV1QiLCJhbGciOiJIUzI1NiJ9.eyJjYWZlVHlwZSI6IkNBRkVfVVJMIiwiYXJ0aWNsZUlkIjo3NDU3OTAyOCwiY2FmZVVybCI6Imltc2FuYnUiLCJpc3N1ZWRBdCI6MTc0NDM1ODM1MjUyN30.chjL4v3hdYZpAGFYnsNQ0-N4_2TjAzqr5ZNOwHtAUfw%26query%3D%25EC%2595%2584%25EC%259D%25B4%25EB%258F%258C%25EB%25B4%2584%25EC%2584%259C%25EB%25B9%2584%25EC%258A%25A4,정부지원 아이돌봄서비스 괜찮나요?/ 아산,11개월 아기 어린이집 안보내고 가정보육중인데7월에 출산이라….이제 배가 불러오는데^^​1. 돌봄서비스 이용해보신분 후기가 궁금합니다!​2. 선생님 추천해주실분 계실까요…?​3. 신청하면 매칭 빨리되나요?,"저는 이제 신청해서 배정기다리고있어요사전신청하고 등급판정받고 배정등 기다리는시간이 있어요,,,우선 사전준비하시고 기관에 연락해 문의하는게 저일 빠른길같아요"
https://cafe.naver.com/gimhaezumma?iframe_url=%2FArticleRead.nhn%3Fclubid%3D21031223%26articleid%3D2619950%26art%3DaW50ZXJuYWwtY2FmZS13ZWItc2VjdGlvbi1zZWFyY2gtbGlzdA.eyJ0eXAiOiJKV1QiLCJhbGciOiJIUzI1NiJ9.eyJjYWZlVHlwZSI6IkNBRkVfVVJMIiwiYXJ0aWNsZUlkIjoyNjE5OTUwLCJjYWZlVXJsIjoiZ2ltaGFlenVtbWEiLCJpc3N1ZWRBdCI6MTc0NDM1ODM1NDA3NH0.339ayAn-1_e-Oh4Pv-g2l-JYKFaaoTlJFP22_YW5hpY%26query%3D%25EC%2595%2584%25EC%259D%25B4%25EB%258F%258C%25EB%25B4%2584%25EC%2584%259C%25EB%25B9%2584%25EC%258A%25A4,아이돌봄서비스신청이요!! ㅠ,​안녕하세요! 정부지원말고 사비로 아이돌봄을 신청하려하는데요어디서 어떻게 하는건지 모르겠어서요 타지에서 이사온지얼마안되서 아무것도 모르네요 ㅠㅠ 비용도그렇고당장 목요일부터 써야하는데 알려주실분계실까요 ?부탁드려요 ㅠㅠ​​​​❌저작권/명예훼손 관련 게시글 작성 시 주의❌,댓글 없음
https://cafe.naver.com/cjsam?iframe_url=%2FArticleRead.nhn%3Fclubid%3D20479493%26articleid%3D4829862%26art%3DaW50ZXJuYWwtY2FmZS13ZWItc2VjdGlvbi1zZWFyY2gtbGlzdA.eyJ0eXAiOiJKV1QiLCJhbGciOiJIUzI1NiJ9.eyJjYWZlVHlwZSI6IkNBRkVfVVJMIiwiYXJ0aWNsZUlkIjo0ODI5ODYyLCJjYWZlVXJsIjoiY2pzYW0iLCJpc3N1ZWRBdCI6MTc0NDM1ODM1NDA3Nn0.QzmgxV37RnUtHx1OvslwfGG4CcOCwv99a8rR3cUVMi0%26query%3D%25EC%2595%2584%25EC%259D%25B4%25EB%258F%258C%25EB%25B4%2584%25EC%2584%259C%25EB%25B9%2584%25EC%258A%25A4,"👶 ""아픈 아이 병원돌봄"" 서비스 주말 확대 🧡","소중한 우리아이  갑작스런 입원, 이제 당황하지 마세요순천시에서는 육아 공백을 해소하고 양질의 양육 서비스 제공을 위해「아픈아이 병원돌봄 서비스」를  평일뿐만 아니라 주말까지 확대 운영합니다 😊「아픈아이 병원돌봄 서비스」는3개월 이상, 12세 이하의 양육 공백이 발생한 입원 아동을 대상으로전문 교육을 이수한 아이돌보미가 병원에 방문하여아동의 식사, 복약 지원 및 정서적 돌봄을 제공하는 1:1 서비스로2023년 전남 최초로 도입한 정책입니다.🧡 신청기간  :연중🧡 신청대상 :3개월 이상 ~ 12세 이하 양육 공백이 발생한 입원 아동🧡 양육공백  :한부모・장애부모・다자녀・맞벌이 가정 등🧡 서비스장소 :아동 입원병원 내🧡 서비스내용  :입원 아동의 식사, 복약지원, 놀이 및 정서적 돌봄🧡 이용시간 :(평일) 08:00~19:00 ⇒(평일 및 주말) 08:00 ~ 19:00※ 1일 4시간 이상 ~ 8시간 이내  *8시간 이용시 별도 문의🧡 이용요금📌 (평일)시간당 14,000원(소득에 따라 차등 지원)📌(주말) 시간당 14,000원(소득에 따라 차등 지원) +7,000원 본인부담금 추가 발생🧡 수행기관  :(사)순천YWCA 아픈아이병원돌봄 서비스지원팀 ☎061-743-5852​",안녕하세요 ~ 채팅 확인 한번만 부탁드려요~
https://cafe.naver.com/csj227?iframe_url=%2FArticleRead.nhn%3Fclubid%3D15309964%26articleid%3D353548%26art%3DaW50ZXJuYWwtY2FmZS13ZWItc2VjdGlvbi1zZWFyY2gtbGlzdA.eyJ0eXAiOiJKV1QiLCJhbGciOiJIUzI1NiJ9.eyJjYWZlVHlwZSI6IkNBRkVfVVJMIiwiYXJ0aWNsZUlkIjozNTM1NDgsImNhZmVVcmwiOiJjc2oyMjciLCJpc3N1ZWRBdCI6MTc0NDM1ODM1NDA3N30.iS7dLB3etDK_iLYLGNSMqVOuJdfWoVY4HGPSCGAoc8w%26query%3D%25EC%2595%2584%25EC%259D%25B4%25EB%258F%258C%25EB%25B4%2584%25EC%2584%259C%25EB%25B9%2584%25EC%258A%25A4,제목 없음,내용 없음,댓글 없음
https://cafe.naver.com/imsanbu?iframe_url=%2FArticleRead.nhn%3Fclubid%3D10094499%26articleid%3D74443664%26art%3DaW50ZXJuYWwtY2FmZS13ZWItc2VjdGlvbi1zZWFyY2gtbGlzdA.eyJ0eXAiOiJKV1QiLCJhbGciOiJIUzI1NiJ9.eyJjYWZlVHlwZSI6IkNBRkVfVVJMIiwiYXJ0aWNsZUlkIjo3NDQ0MzY2NCwiY2FmZVVybCI6Imltc2FuYnUiLCJpc3N1ZWRBdCI6MTc0NDM1ODM1NDA3OX0.4h9T21ZSo-0VErh_Qlc6fNIty63XeU7aJoj4LZVxHkk%26query%3D%25EC%2595%2584%25EC%259D%25B4%25EB%258F%258C%25EB%25B4%2584%25EC%2584%259C%25EB%25B9%2584%25EC%258A%25A4,아이돌봄 서비스 처음 이용해보는데요,10개월 아가들 돌봄 서비스 신청 몇 달동안 했는데 이제야 한 분 오시네요ㅜ근데 궁금한게 있어서요​저는 그동안 신청만 했고 실제 이용은 지금이 처음인데 왜 시간이 깎여있는걸까요?​연계가 안돼도 신청만 한다고 해서 시간이 차감되는건가요???​,취소되면 시간 다시 돌아와요
https://cafe.naver.com/gangmok?iframe_url=%2FArticleRead.nhn%3Fclubid%3D14042965%26articleid%3D1904955%26art%3DaW50ZXJuYWwtY2FmZS13ZWItc2VjdGlvbi1zZWFyY2gtbGlzdA.eyJ0eXAiOiJKV1QiLCJhbGciOiJIUzI1NiJ9.eyJjYWZlVHlwZSI6IkNBRkVfVVJMIiwiYXJ0aWNsZUlkIjoxOTA0OTU1LCJjYWZlVXJsIjoiZ2FuZ21vayIsImlzc3VlZEF0IjoxNzQ0MzU4MzU0MDgwfQ.se-ZKd3cI6A3I7unwS370YMLJBPOiJ7nwGjL7Dy9qIM%26query%3D%25EC%2595%2584%25EC%259D%25B4%25EB%258F%258C%25EB%25B4%2584%25EC%2584%259C%25EB%25B9%2584%25EC%258A%25A4,강남구에서는 아이돌봄 서비스가 무료?,"강남구가 올해부터 아이돌봄 서비스 예산을 100억 넘게 편성하고 지원금을 많이 풀고 있어요. 잘하면 아예 한 푼도 안내고 서비스 받을 수도 있겠네요.​아이돌봄 서비스는 맞벌이 등으로 양육 공백 있는 가정에 정부에서 돌보미를 보내줘서 만 12살 이하 아동 돌봐주는 서비스인데요. 올해부터는 지원 대상이 중위소득 150%이하에서 200%이하로 확대됐어요.​소득기준에 따라 가형(기준중위소득 75% 이하), 나형(120% 이하), 다형(150% 이하), 라형(200% 이하), 마형(200% 초과)으로 분류해서 정부에서 요금을 지원하고 있고요.​강남구는 여기에 추가로 본인부담금 50~100%를 지원하고 있어요. 가형 같은 경우엔 정부가 요금 85%를 지원해주고 있는데 나머지 15%는 강남구가 내준다고 합니다. 그냥 무료로 서비스 이용할 수 있는 거죠.​마형도 강남구가 본인 부담할 금액의 50%까지는 지원해주기로 했어요. 소득기준이 어디에 해당하든 상당한 도움이 될 거 같네요~",강남구는 진짜 애 키우기 좋네요ㅎㅎ 그래서 출산률이 높은가봐요~~
https://cafe.naver.com/usem?iframe_url=%2FArticleRead.nhn%3Fclubid%3D12165814%26articleid%3D2366685%26art%3DaW50ZXJuYWwtY2FmZS13ZWItc2VjdGlvbi1zZWFyY2gtbGlzdA.eyJ0eXAiOiJKV1QiLCJhbGciOiJIUzI1NiJ9.eyJjYWZlVHlwZSI6IkNBRkVfVVJMIiwiYXJ0aWNsZUlkIjoyMzY2Njg1LCJjYWZlVXJsIjoidXNlbSIsImlzc3VlZEF0IjoxNzQ0MzU4MzU0MDgxfQ.UExzSXxtHgcGq6jovMtlmyspSbE8lkJxeRzvdeJYdGU%26query%3D%25EC%2595%2584%25EC%259D%25B4%25EB%258F%258C%25EB%25B4%2584%25EC%2584%259C%25EB%25B9%2584%25EC%258A%25A4,제목 없음,내용 없음,댓글 없음
https://cafe.naver.com/yangmom?iframe_url=%2FArticleRead.nhn%3Fclubid%3D22788814%26articleid%3D676783%26art%3DaW50ZXJuYWwtY2FmZS13ZWItc2VjdGlvbi1zZWFyY2gtbGlzdA.eyJ0eXAiOiJKV1QiLCJhbGciOiJIUzI1NiJ9.eyJjYWZlVHlwZSI6IkNBRkVfVVJMIiwiYXJ0aWNsZUlkIjo2NzY3ODMsImNhZmVVcmwiOiJ5YW5nbW9tIiwiaXNzdWVkQXQiOjE3NDQzNTgzNTQwODJ9.f1qw_EADZatXbgYKLmyvRDOar-drIRrkSj6gxizD1CU%26query%3D%25EC%2595%2584%25EC%259D%25B4%25EB%258F%258C%25EB%25B4%2584%25EC%2584%259C%25EB%25B9%2584%25EC%258A%25A4,"[아이돌봄서비스] 어린이집, 유치원 이용가정 정부지원안내",안녕하세요 양평군가족센터 아이돌봄팀입니다.시설이용가정 정부지원안내드립니다.아이돌봄 이용문의는 센터(031-775-5955)로 부탁드립니다. 감사합니다.​,댓글 없음
https://cafe.naver.com/imsanbu?iframe_url=%2FArticleRead.nhn%3Fclubid%3D10094499%26articleid%3D74222062%26art%3DaW50ZXJuYWwtY2FmZS13ZWItc2VjdGlvbi1zZWFyY2gtbGlzdA.eyJ0eXAiOiJKV1QiLCJhbGciOiJIUzI1NiJ9.eyJjYWZlVHlwZSI6IkNBRkVfVVJMIiwiYXJ0aWNsZUlkIjo3NDIyMjA2MiwiY2FmZVVybCI6Imltc2FuYnUiLCJpc3N1ZWRBdCI6MTc0NDM1ODM1NDA4M30.skRBsoU1MaXt8rSAQf8QnvfAc9TzThW3WEBTBIcY9AU%26query%3D%25EC%2595%2584%25EC%259D%25B4%25EB%258F%258C%25EB%25B4%2584%25EC%2584%259C%25EB%25B9%2584%25EC%258A%25A4,아이돌봄서비스,서비스신청해서 이용중인데모니터링이라는게 있다더라구요선생님들근무시간에 전화온다길래애보는시간인거뻔히알면서 전화하는거부터가어이없는데;영상모니터링이라며 애를보여주라한다네요??아직까지는 저희선생님한테는 안온건지저있을때 그딴전화안오긴했는데정부지원이라그런지 참 불편하게구네요돌봄서비스 이용하시면 참고들하세요!!참고로 아이가거부하면 뒷모습이라도보여달라한다는데저희아이들은 아직의사표현못할개월이라괜히화나서 글적어보네요,진짜로 그 집에서 이용중인지 확인하려고 하는 것 같은데요.. 세금이니까;
https://cafe.naver.com/imsanbu?iframe_url=%2FArticleRead.nhn%3Fclubid%3D10094499%26articleid%3D74827202%26art%3DaW50ZXJuYWwtY2FmZS13ZWItc2VjdGlvbi1zZWFyY2gtbGlzdA.eyJ0eXAiOiJKV1QiLCJhbGciOiJIUzI1NiJ9.eyJjYWZlVHlwZSI6IkNBRkVfVVJMIiwiYXJ0aWNsZUlkIjo3NDgyNzIwMiwiY2FmZVVybCI6Imltc2FuYnUiLCJpc3N1ZWRBdCI6MTc0NDM1ODM1NDA4NH0.5xMbCQ9xM4D4uoPqt4BnYHHH01xv2BhSpd-qvciemg0%26query%3D%25EC%2595%2584%25EC%259D%25B4%25EB%258F%258C%25EB%25B4%2584%25EC%2584%259C%25EB%25B9%2584%25EC%258A%25A4,"아이돌봄은, 맞벌이만 신청 가능한거에요?","아이는 1명이고,이제 일 시작해서 (아르바이트)소득증명 할 것 이 없는것 같은데요..​​소득 증명이 있어야정부지원 판정을 신청해서 받을 수 있고그걸로 아이돌봄 서비스를 신청 하는거라고 하네요(행정복지센터에서)​당장은 입증할 것이 없으면돌봄 서비스 이용 못하나요?(맨날 쓰려는거 아니고, 아이 아플때 돌발상황에 얼집 못가게되면 하루정도씩 그럴때만 쓰려고요..)​(처음엔 돈 다주고 이용할 생각도 있습니더ㅠ방법이 없으니까요ㅠ)​이용 못하는게 맞나요??",아뇨~ 주변에 전업인데도 돌봄서비스 받더라구요~ 애기 맡겨놓고 운동하러가더라구요.
https://cafe.naver.com/62831003?iframe_url=%2FArticleRead.nhn%3Fclubid%3D30886032%26articleid%3D189377%26art%3DaW50ZXJuYWwtY2FmZS13ZWItc2VjdGlvbi1zZWFyY2gtbGlzdA.eyJ0eXAiOiJKV1QiLCJhbGciOiJIUzI1NiJ9.eyJjYWZlVHlwZSI6IkNBRkVfVVJMIiwiYXJ0aWNsZUlkIjoxODkzNzcsImNhZmVVcmwiOiI2MjgzMTAwMyIsImlzc3VlZEF0IjoxNzQ0MzU4MzU0MDg1fQ.MQ3NAYarK3lFWh0MikrTHrz9-tvZwdxAoccJyi1-oIw%26query%3D%25EC%2595%2584%25EC%259D%25B4%25EB%258F%258C%25EB%25B4%2584%25EC%2584%259C%25EB%25B9%2584%25EC%258A%25A4,"익산시, 아이돌봄서비스 본인부담금 지원","전북 익산시는 아이돌봄서비스 이용 가정의 부담을 줄이기 위해 본인부담금 지원사업을 추진한다고 3일 밝혔다. 아이돌봄서비스는 아이돌보미가 가정에 방문해 학습 보조나 급·간식 지원, 등·하원, 병원 진료 동행 등 돌봄을 제공하는 사업이다.​익산시는 가정별로 첫째 아이의 경우 본인부담금 70%를, 둘째 이상은 부담금 전액을 지원한다. 이를 위해 올해 예산으로 86억 원을 확보했다. 지원금은 지역화폐 익산사랑상품권 ‘다이로움’으로 지급된다. 익산시는 이 사업이 돌봄 가정의 경제적 부담을 줄이는 동시에 지역 내 소비 촉진에도 도움이 될 것으로 기대한다. 이 사업은 2021년부터 추진하고 있는데, 올해 500여 명의 아동이 혜택을 받는다.​익산시는 이밖에 △지역 돌봄센터 △가정양육 수당 △공동육아 나눔터 등 다양한 육아·보육 지원 정책을 추진하고 있다. 정헌율 익산시장은 “단순한 돌봄 지원을 넘어 부모들의 양육 부담을 줄이면서도 아이들이 안전하고 건강하게 성장할 수 있는 환경을 조성하는 데 중요한 의미를 가진다”며 “다양한 육아·보육 지원 정책을 확대해 부모와 아이 모두가 행복한 익산시를 만들어 나가겠다”고 말했다.​​​​​​​​​​​​​​꿈이있어 행복한 사람들의 모임복지카페 기초생활수급자 차상위한부모가족 장애인 저소득층",정보 감사합니다
https://cafe.naver.com/tgpia?iframe_url=%2FArticleRead.nhn%3Fclubid%3D20158432%26articleid%3D895274%26art%3DaW50ZXJuYWwtY2FmZS13ZWItc2VjdGlvbi1zZWFyY2gtbGlzdA.eyJ0eXAiOiJKV1QiLCJhbGciOiJIUzI1NiJ9.eyJjYWZlVHlwZSI6IkNBRkVfVVJMIiwiYXJ0aWNsZUlkIjo4OTUyNzQsImNhZmVVcmwiOiJ0Z3BpYSIsImlzc3VlZEF0IjoxNzQ0MzU4MzU0MDg3fQ.NF5sZQ7yskdlAwbAeOCeYjKRSCrynITHQUuzeALQ2uY%26query%3D%25EC%2595%2584%25EC%259D%25B4%25EB%258F%258C%25EB%25B4%2584%25EC%2584%259C%25EB%25B9%2584%25EC%258A%25A4,통영 아이돌봄서비스,"1. 아이가 갑자기 아파서 하원요청이 왔을 때 부모 둘 다 일을 뺄 수 없을 때요!아이돌봄서비스를 이용하면 당일에 바로 돌봄선생님이 와주시나요???​2. 공휴일, 주말에도 돌봄서비스 이용이 가능한가요???​3. 지원자격, 필요서류, 돌봄금액은 관할 동사무소에 문의해야하나요??​4. 시간제보육?이랑 아이돌봄서비스랑 같은건가요~????",1.3'은 통영가족센터에 문의 하면 정확한 답변 들을수 있음.주말. 공휴일 미리 신청하면 가능함시간제보육은 어린이집.돌봄서비스는 가족센터에 돌봄신청하는거예요~
https://cafe.naver.com/kyungmammo?iframe_url=%2FArticleRead.nhn%3Fclubid%3D22897837%26articleid%3D6400507%26art%3DaW50ZXJuYWwtY2FmZS13ZWItc2VjdGlvbi1zZWFyY2gtbGlzdA.eyJ0eXAiOiJKV1QiLCJhbGciOiJIUzI1NiJ9.eyJjYWZlVHlwZSI6IkNBRkVfVVJMIiwiYXJ0aWNsZUlkIjo2NDAwNTA3LCJjYWZlVXJsIjoia3l1bmdtYW1tbyIsImlzc3VlZEF0IjoxNzQ0MzU4MzU0MDg4fQ.so2qlUj7sdG4_6PCYIrSmMAuCt3Ytne_P_zfPacnoIM%26query%3D%25EC%2595%2584%25EC%259D%25B4%25EB%258F%258C%25EB%25B4%2584%25EC%2584%259C%25EB%25B9%2584%25EC%258A%25A4,곧 아이돌봄시 시터 범죄경력 조회 가능해 진다고 합니다.,"아이돌봄 지원법 개정안은 ▲아이돌봄사 국가자격제도 도입 ▲아이돌봄서비스제공기관 등록제 도입 ▲등록 아이돌봄서비스제공기관의 육아도우미 및 기관종사자에 대한 결격사유 적용 및 범죄경력조회 요청 근거 신설 등 아이돌봄 서비스의 질적 개선과 돌봄 시장의 신뢰 제고를 위한 것으로, 지난해부터 수 차례의 상정과 치열한 논의가 이루어진 끝에 법안소위를 통과했다. <서범수의원 블로그 펌>​일 똑바로 안하나… 당연히 통과가 되야지…",이미 다 하고 있는거 아니에요?
https://cafe.naver.com/magic26?iframe_url=%2FArticleRead.nhn%3Fclubid%3D20091703%26articleid%3D2154525%26art%3DaW50ZXJuYWwtY2FmZS13ZWItc2VjdGlvbi1zZWFyY2gtbGlzdA.eyJ0eXAiOiJKV1QiLCJhbGciOiJIUzI1NiJ9.eyJjYWZlVHlwZSI6IkNBRkVfVVJMIiwiYXJ0aWNsZUlkIjoyMTU0NTI1LCJjYWZlVXJsIjoibWFnaWMyNiIsImlzc3VlZEF0IjoxNzQ0MzU4MzU1MjMyfQ.t8IVvMh2Z4UJmyN6GgI0H31s-rR_1xHHQxjBcy-pdVk%26query%3D%25EC%2595%2584%25EC%259D%25B4%25EB%258F%258C%25EB%25B4%2584%25EC%2584%259C%25EB%25B9%2584%25EC%258A%25A4,아이돌봄서비스 후기,말 그대로 아이 둘 낳고 처음 아이돌보미 신청을 했어요일요일이였고 사정이 있어서 4시간을 신청했는데 다행이 금방 수락이 되더라구요서비스 당일 10분전에 도착해주셨고 간단히 아이 소개하고 대강 간식 위치 설명드리고 저는 볼 일 있어서 나왔어요일일히 말하지 않아도 돌봄선생님께서 어련히 잘 봐주시겠지 하고 안일하게 생각한 제 잘못도 크네요.. ^^​cctv있다고 기재해놨고. 집 나온지 1시간 쯤 지나서 cctv를 확인하니 리모컨으로 티비를 켜시더라구요.둘째가 21개월이라 저는 tv를 잘 안보여주는데.. 잠깐은 이해하자 생각하고 넘어갔는데 잠깐이 아니라 1시간이 넘더라구요 ㅎㅎ선생님 포함 다같이 누워서 30분 정도 시청하다가 다시 앉아서 보고.. 그 시간동안 둘째는 tv 코 앞에 앉아서 보고 있어도 따로 제지를 안해요 (최근에 티비다이를 버려서 티비가 바닥에 놓여있어요)이건 너무 아니다 싶어서 급하게 집으로 갔는데 역시나 여전히 티비 바로 앞에 앉아서 시청 중.. 1시간 30분째였습니다 ㅋㅋ​돌봄서비스가 이렇게 티비만 계속 보여주는게 맞는거냐 두돌도 안된 아이가 왜 이렇게 티비를 가까이서 보게 두었는지  물었더니나가기전에 책을 읽어줘라 뭘 해줘라 얘기도 없었고 아이들이 두명인데 심심해 해서 틀어줬대요 ...그래서 집으로 가시라 했습니다 일찍 귀가 했으니 이제는 제가 돌보겠다구요..가시면서 위약금  말하시길래 내일 센터에 전화해서 알아보겠다 했습니다​5살 첫째아이. 21개월 둘째아이 돌봄 비용이 휴일 수당까지 해서 4시간에 10만원이 넘는 돈이 지불되는데 (정부지원포함)서비스가 너무 엉망이라 당시 너무 화가 났습니다 ㅠㅠ​다음날 센터에 전화를 했고 상황설명 후 위약금이 아니라 환불을 받아야하는 상황이 아닐까요 물었더니 이같은 건은 규정이 없어서 환불 안되고 돌봄선생님을 중간에 돌려 보냈으니  취소 수수료 자동결제 된다고....ㅎ​그래서 결론은 아이돌봄서비스 처음 이용하시는 분들은 요청사항 자세히 써주시고 티비시청 싫어하시는 저와 같은 어머님은 금지라고 꼭 꼭 적어놓으시길 바랍니다주위에 이용해 본 지인들도 없어서 저는 몰랐네요....이상 정부지원 아이돌봄서비스 첫 이용 후기였습니다 ㅠㅠ,티비시청은 너무하네요..30분도아니고 1시간30분이라니..그래도 돌봄은 바로 매칭되나요?
