url,title,content,reply
https://cafe.naver.com/imsanbu?iframe_url=%2FArticleRead.nhn%3Fclubid%3D10094499%26articleid%3D71664161%26art%3DaW50ZXJuYWwtY2FmZS13ZWItc2VjdGlvbi1zZWFyY2gtbGlzdA.eyJ0eXAiOiJKV1QiLCJhbGciOiJIUzI1NiJ9.eyJjYWZlVHlwZSI6IkNBRkVfVVJMIiwiYXJ0aWNsZUlkIjo3MTY2NDE2MSwiY2FmZVVybCI6Imltc2FuYnUiLCJpc3N1ZWRBdCI6MTc0NDM1ODM3OTYwNH0.gq6gyjeqHqXByNRqoDHwvWtgZypGE2eDzn42qIqZcbw%26query%3D%25EC%2595%2584%25EC%259D%25B4%25EB%258F%258C%25EB%25B4%2584%25EC%2584%259C%25EB%25B9%2584%25EC%258A%25A4,아이돌봄 서비스,"맞벌이만 이용가능한가요?제가 공무원 육휴중이고, 남편은 대학원생이라 9-19시 출근해서 공부하고 있어요. 4대보험 이런거 없어요~​지금 둘째 임신중인데요, 저희 같은 상황도 아이돌봄 서비스 이용 가능한가요?​그리고 아이돌봄 서비스 이용해보신분들 만족하시나요~?시간을 쓴다면 점심쯤 쓰는게 좋겠죠?ㅎㅎ​팁 좀 주세용🥰🥰","‘라’형이 맞벌이 아닌 사람들 이용하는 구간이더라구요~ 이용해보지는 않았지만, 친구가 한다길래 찾아봤었어요. 아이돌봄 홈페이지가면 나와있어요!"
https://cafe.naver.com/tgpia?iframe_url=%2FArticleRead.nhn%3Fclubid%3D20158432%26articleid%3D877769%26art%3DaW50ZXJuYWwtY2FmZS13ZWItc2VjdGlvbi1zZWFyY2gtbGlzdA.eyJ0eXAiOiJKV1QiLCJhbGciOiJIUzI1NiJ9.eyJjYWZlVHlwZSI6IkNBRkVfVVJMIiwiYXJ0aWNsZUlkIjo4Nzc3NjksImNhZmVVcmwiOiJ0Z3BpYSIsImlzc3VlZEF0IjoxNzQ0MzU4Mzc5NjA2fQ.OmerGHltIZ62CBjfzbnQ_XFhXvRYjOTcgFOXFjWfPn4%26query%3D%25EC%2595%2584%25EC%259D%25B4%25EB%258F%258C%25EB%25B4%2584%25EC%2584%259C%25EB%25B9%2584%25EC%258A%25A4,아이돌봄 서비스 해보신분..?,"안녕하세요 100일 아기엄마에요오전에 2시간정도 운동을 하고싶은데애기 봐줄사람이 없어서 수영장을 못가고잇네요 ㅠㅠ걷기가 힘들어서 수영장에서 걸을라하는데혹시 통영에 아이돌봄 서비스 받아보신분 있으실까요후기좀 부탁드려요 ㅎㅎㅎ 아직 애기가 너무 어려서100일 정도된 아기도 서비스 받는지요 .. 운동은 …제 욕심일까요 .,",네  동사무소가서 자격되는지 신청 먼저 해보셔요자격 되면 건강보험기준으로  결재금액 정해져요 !3개월 이상 아기면 다 봐주는걸로 알고잇습니다저는 지금 4-5년째 한선생님이 쭈욱 봐주시는데너무 만족해요 .근데 오시는 선생님이랑 성격이나 이런게 부딪히면아이돌봄 하다가 안쓰시는분들도 계시더라구요그건 추후 문제니 자격조건 되는지부터 알아보샤요 ~
https://cafe.naver.com/no1sejong?iframe_url=%2FArticleRead.nhn%3Fclubid%3D24361059%26articleid%3D3795687%26art%3DaW50ZXJuYWwtY2FmZS13ZWItc2VjdGlvbi1zZWFyY2gtbGlzdA.eyJ0eXAiOiJKV1QiLCJhbGciOiJIUzI1NiJ9.eyJjYWZlVHlwZSI6IkNBRkVfVVJMIiwiYXJ0aWNsZUlkIjozNzk1Njg3LCJjYWZlVXJsIjoibm8xc2Vqb25nIiwiaXNzdWVkQXQiOjE3NDQzNTgzNzk2MDh9.h-60ooop_4fACIobXXxJf1Cj7uOZbRkO_NSdGjUqWuA%26query%3D%25EC%2595%2584%25EC%259D%25B4%25EB%258F%258C%25EB%25B4%2584%25EC%2584%259C%25EB%25B9%2584%25EC%258A%25A4,아이돌봄서비스 돌봄선생님 추천,가족사업때문에 일을 바로 시작해야 해서 돌봄서비스를 이용하려고 하는데3월부터 아이 어린이집 보내서 돌봄서비스 더이상 이용 안하시는 분들 중에돌봄 선생님 추천 받을 수 있을까요?손주처럼 아이 예뻐하면서 잘 봐주시는 분 찾고 있어요!,돌봄 선생님이 추천이 가능한가요? 원하는 시간대와 맞는 선생님 랜덤배정일텐데
https://cafe.naver.com/imsanbu?iframe_url=%2FArticleRead.nhn%3Fclubid%3D10094499%26articleid%3D72600807%26art%3DaW50ZXJuYWwtY2FmZS13ZWItc2VjdGlvbi1zZWFyY2gtbGlzdA.eyJ0eXAiOiJKV1QiLCJhbGciOiJIUzI1NiJ9.eyJjYWZlVHlwZSI6IkNBRkVfVVJMIiwiYXJ0aWNsZUlkIjo3MjYwMDgwNywiY2FmZVVybCI6Imltc2FuYnUiLCJpc3N1ZWRBdCI6MTc0NDM1ODM3OTYxMH0.oweTsJ4iOglKO6SnFmpI9cPwXajArKwezGmzm7r1cM0%26query%3D%25EC%2595%2584%25EC%259D%25B4%25EB%258F%258C%25EB%25B4%2584%25EC%2584%259C%25EB%25B9%2584%25EC%258A%25A4,아이돌봄서비스 이용해보신분 선생님 업무,아이돌봄선생님이 이번에 바뀌었는데요아침등원 7시부터9시  이용중인데​아이가 유치원생인데오늘아침에8시쯤 볶은밥준비된거먹이고​식판1개 .요거트그릇1개.물컵1개  수저씻을거리가나왔는데​아이돌보미선생님께 아이가먹은것 씻는거부탁드렸더니그건본인업무가아니라고 가사서비스는본인일이아니라고하시는데 이게 맞나요?​​​7월교육수료하고 처음오신분인데교육때 얘기들었다면서이렇게 아이먹은그릇설거지안하고물에담궈두시면제가 퇴근하고와서 씻는게맞나요​돌봄오시면 오늘무슨책읽어주지하면서쇼파앉아계시면옷골라서내놓고 양치시키고 제가다준비하는데책2권읽어주시고차량 10분전 나가십니다​제가 음식다준비된거선생님이 떠주고과일 사과정도는 깎아주시고   아이밥먹을때옆에서 얘기해주시는거선생님업무아닌가요​저희지역담당센터전화로물어보니보통융통성있게하시는데원칙상 가사서비스는 미포함이라면서​영아는젖병씻기되는데아이먹은 그릇 씻는거 자기일아니라고하시는거이해가잘안되서요​​​,"과일 깍아주고,설거지하고.. 그런거 포함 안되는거맞아요 같이하려면 더 지불하셔야합니다"
https://cafe.naver.com/2005mam?iframe_url=%2FArticleRead.nhn%3Fclubid%3D11209065%26articleid%3D1681364%26art%3DaW50ZXJuYWwtY2FmZS13ZWItc2VjdGlvbi1zZWFyY2gtbGlzdA.eyJ0eXAiOiJKV1QiLCJhbGciOiJIUzI1NiJ9.eyJjYWZlVHlwZSI6IkNBRkVfVVJMIiwiYXJ0aWNsZUlkIjoxNjgxMzY0LCJjYWZlVXJsIjoiMjAwNW1hbSIsImlzc3VlZEF0IjoxNzQ0MzU4Mzc5NjEzfQ.Df7LJM4HUCde425BiT5Jfux978CkHng0f5dQci92n2s%26query%3D%25EC%2595%2584%25EC%259D%25B4%25EB%258F%258C%25EB%25B4%2584%25EC%2584%259C%25EB%25B9%2584%25EC%258A%25A4,감기 걸린 아기 아이돌봄서비스 이용을 어떻게 해야하나요??,33개월 아기인데 지금 감기에 걸렸는데 계속 고열이였다가 미열이였다가 계속 반복하고 잇어요..맞벌이 가정인데 이제는 도저히 빼지를 못해서 급하게 아이돌봄서비스를 알아보고 있는데 열이 나는 아이일 경우 질병아동돌봄서비스를 이용해야겟죠..?감기 걸린 아이는 일시연계서비스는 안되겠죠..?질병돌봄서비스인 경우 바로바로 구해질까요..? 어떻게 하면 좋을까요..돌봄서비스 말고도 다른 방법이 있을까요??​조금 멘붕이라 제대로 이해가 되지 않고 있네요..ㅠㅠ,제가 알기론 법정감염병만 질병아동서비스쓰는걸로 알고있어요 그냥 감기는 일반서비스쓰면될걸요 센터에 물어보시면 더정확할거같아요
https://cafe.naver.com/imsanbu?iframe_url=%2FArticleRead.nhn%3Fclubid%3D10094499%26articleid%3D68832531%26art%3DaW50ZXJuYWwtY2FmZS13ZWItc2VjdGlvbi1zZWFyY2gtbGlzdA.eyJ0eXAiOiJKV1QiLCJhbGciOiJIUzI1NiJ9.eyJjYWZlVHlwZSI6IkNBRkVfVVJMIiwiYXJ0aWNsZUlkIjo2ODgzMjUzMSwiY2FmZVVybCI6Imltc2FuYnUiLCJpc3N1ZWRBdCI6MTc0NDM1ODM4MDgyM30.wynuAF3STtBRkAbpQ8YZVdPJlknOqzfm4MhHauBH_8I%26query%3D%25EC%2595%2584%25EC%259D%25B4%25EB%258F%258C%25EB%25B4%2584%25EC%2584%259C%25EB%25B9%2584%25EC%258A%25A4,아이돌봄서비스 궁금해요,혹시 아이돌봄 서비스를 받고 계신 가정있나요??저는 지금 부산에 거주하고 첫째는 17개월이고 둘째는 임신중에 있습니다^^주변에 듣기론 둘째 출산 3개월전 첫째 아이돌봄 신청을 할 수 있다고 들었어요! 어린이집 하원 이후 4시부터 돌봄선생님이 오신다고 하시더라구요.그리고 둘째도 출산하면 신생아때부터 돌봄 신청 가능하다고 들었는데 저희는 현재 남편만 일을 하고 있고 저는 주부인 상태입니다.그래도 첫째 둘째 다 아이돌봄을 할 수 있나요?아는분이 할 수 있다고 하던데 검색해도 잘 모르겠더라구요혹시 아시는분 알려주시면 감사하겠습니다^^,외벌이도 상관없어요등급판정받아서 사용하심됩니다!3갤 미만아가들도 동의서? 그런거 싸인후 이용하심됩니다
https://cafe.naver.com/imsanbu?iframe_url=%2FArticleRead.nhn%3Fclubid%3D10094499%26articleid%3D73332771%26art%3DaW50ZXJuYWwtY2FmZS13ZWItc2VjdGlvbi1zZWFyY2gtbGlzdA.eyJ0eXAiOiJKV1QiLCJhbGciOiJIUzI1NiJ9.eyJjYWZlVHlwZSI6IkNBRkVfVVJMIiwiYXJ0aWNsZUlkIjo3MzMzMjc3MSwiY2FmZVVybCI6Imltc2FuYnUiLCJpc3N1ZWRBdCI6MTc0NDM1ODM4MDgyNX0.Fdc8dlWv4NYU0cVAdsu7u79dBVOrsLd0yp26vs0IY9o%26query%3D%25EC%2595%2584%25EC%259D%25B4%25EB%258F%258C%25EB%25B4%2584%25EC%2584%259C%25EB%25B9%2584%25EC%258A%25A4,아이돌봄 서비스랑 산모 신생아 건강관리사 서비스 차이가 뭔가요,아이돌봄 서비스랑 산모 신생아 건강관리사 서비스 차이가 뭔가요??!그냥산후 바로받냐생후 3갤부터 받냐 차이인가요?..!,아이돌봄은 집안일은 안해주시죠
https://cafe.naver.com/fmms02?iframe_url=%2FArticleRead.nhn%3Fclubid%3D25276190%26articleid%3D398015%26art%3DaW50ZXJuYWwtY2FmZS13ZWItc2VjdGlvbi1zZWFyY2gtbGlzdA.eyJ0eXAiOiJKV1QiLCJhbGciOiJIUzI1NiJ9.eyJjYWZlVHlwZSI6IkNBRkVfVVJMIiwiYXJ0aWNsZUlkIjozOTgwMTUsImNhZmVVcmwiOiJmbW1zMDIiLCJpc3N1ZWRBdCI6MTc0NDM1ODM4MDgyN30.ZzuxRT0Agi0r_VhkSaQcvWgh6lX1ebJkdmIgvJw4tp8%26query%3D%25EC%2595%2584%25EC%259D%25B4%25EB%258F%258C%25EB%25B4%2584%25EC%2584%259C%25EB%25B9%2584%25EC%258A%25A4,진천 아이돌봄 서비스 후기~ 긴글 주의.,"안녕하세요.아이돌봄서비스를 처음 시작했을때 이런게 있다더라~이렇게만 막연히 알고 있다가알아볼려고 하니 정보가 없었고 이용하고 있을때는 주변에서 많이 궁금해 하였어요.작은 도움이 되고자 없는 글솜씨에 글을 작성합니다. 주관적인 의견이 다수 포함되어 있음을 알려드립니다.*돌봄기관과 아무런 관련이 없습니다.저는 타지에 와서 양가부모님이 계시지만 도움을 받지 못하는 상황이었고 첫째까지는 직장을 다녔어요.그래서 육아를 할 때 가장 부러운게 도와주는 친정부모님이나 주변에 도움을 받을 수 있는 친인척이 있다는게 너무나 부럽고 이사를 가야하나 고민까지 했었지요.그러다 둘째 아이가 오랜 시간 동안 아프고 주변에 도움을 받는게 한계가 되었을때 진천군 아이돌봄 서비스를 알게되었어요. 둘째아이 보다는 첫째를 케어해 줄 사람이 너무나 시급했던지라 잠깐만 이용하자 라며 신청했던게 어느덧 5개월이 지나갔습니다.아이돌봄서비스는 초등학생 위주의 맞벌이 가정위주라는 이미지가 강했고 서비스가 필요했던 시기에 아이가 돌 전 아기라서 왠지 장난감 빌리려 종종 가던 육아지원센터의 보육시설을 이용해야 할 것 같고. 건강이 취약했던 시기라 외부의 기관을 이용하고 싶지 않았어요. 그래도 마지막에는 너무 힘들어서 육아지원센터에 이런 서비스가 있는데 어떻게 해야 하냐고 문의하니 너무나 친절하게 아이돌봄센터를 알아봐주셨어요(감사합니다.)1.대상아동은 생후3개월 이상~만12세 이하에요.2. 맞벌이 가정, 취업 한부모가정, 장애부모가정, 다자녀 가정 대상이구요. 저는 아이 두명으로 다자녀로 혜택을 받았고기타 엄마 아빠가 아프거나 학교(학원)다녀야 한다거나 출산해야 하는데 손윗아이 봐줄사람 없다거나 등등으로광범위하게 기준을 널널하게 되어 있어요.3.정부지원+자부담이예요~우리 해보았죠 정부지원 산모도우미할 때~소득기준에 따라 자부담이 달라졌죠~그런류의 시스템입니다. 몇 시간을 쓰느냐에 따라 다르겠지만 다양한 이유로 제대로 돌보지 못했다는 아이에 대한 죄책감으로 쓰는 간식, 장난감 등등의 비용과 힘들어서 쓰는 외식과 병원비를 생각한다면 정말 감사한 비용입니다.우리나라는 복지국가입니다~4. 처음 서비스 시간은 오전 7시부터 신청했었고 등원서비스를 중점으로 신청했었어요.서비스는 최소 2시간, 30분단위로 신청가능하고 제가 알기로는연중 24시간 공휴일도 포함하여 이용가능합니다.(빨간날은 비용이 조금 더 내야하고 야간도 더 내야하는지는 기관에 문의해야 합니다)5.돌봄선생님~너무 감사합니다. 그동안 5명의 선생님을 만났는데 아이와 저에게는 큰 도움이 되었어요.- 여기서 주의해야 할 점.돌봄선생님은 보육선생님이 아닙니다~: 등하원 및 준비물 보조, 부모가 올때까지 임시 보육, 놀이활동, 준비된 식사 및 간식 챙겨주기---가 기본형 시간제 서비스인데요.모든 준비는 부모가 해야하고 놀이도 아이는 이렇게 노는것을 좋아하고 좋아하는 장난감은 이런 류라고 미리 알려드렸습니다.(장점이라고 해야한다면 내 살림을 터치하지 않습니다..^^;;;) 먹었던 식사, 간식 정리, 같이 놀았던 장난감 정리를 해줍니다.(일반가사활동은 불가래요)- 아이와 있었던 일들을 서비스가 끝나고 중점적으로 알려주었고 예를 들어 다쳤다면 어떻게 그런일이 생겼는지 어떻게 대처했는지 바로 알려주셨고(대부분 놀다가 넘어져서 다친 상처들) 이쁜 사진도 보내주기도 하였어요.(매번은 아닙니다.)- 아이들과 어떤 큰 주제를 가지고 놀이활동을 하는게 아니라 아이가 좋아하는 장남감에 대해, 놀이에 대해 같이 관심가져주고 호응해주고 말이 트이지 않아도 계속 말을 걸어주고 반응을 해주셨습니다.그동안 저는 몸과 마음이 지쳐있어서 아이들과 놀이 상호작용이 떨어져 있었는데 이 부분이 특히 감사했습니다.- 돌봄선생님들은 계속 교육받고 있어요.온라인 교육과 몇 달에 한번 씩 오프라인 교육을 받고 있어서 그날은 서비스이용이 힘들다고 하셨고 발달과정에 대한 교육등을 받는것 같았습니다.- 광역아이돌봄지원센터에서현장 모니터링이 나옵니다. 당일방문 직전에 저에게 연락이 왔고 돌봄선생님은 모르는 상황에서 오셨는데 저도 덩달아 가슴이 콩닥콩닥 했어요. 듣기로는 밖에서 돌봄선생님과 아이가 지내는 모습을 지켜본다고도 합니다. 정말 대단하죠~-돌봄선생님들은 연령이 다양합니다. 젊은신 분들도 있지만 대부분이 나이가 있어 아이와 격한 운동, 신체활동은 무리인듯 싶었습니다. 하지만 아이를 대할 때 부드럽고 차분하게 대하셨고 아이가 잘못한 행동을 하였을때 왜 그런 행동/말을 했는지, 그러면 안되는지도 이야기 해주었고 저도 옆에서 많이 반성하고 배웠습니다.​저는 개인적으로도 몸과 마음이 지쳐있어서 그러는지 허리통증, 온몸의 두드러기 등 몸의 이상 신호가 오고 있었어요. 3시간 돌봄서비스를 이용하면서 잠을 자거나 홈트, 산책 등 제 시간을 갖으면서 많이 회복하였고 이제는 간단한 아르바이트를 시작합니다. 그리고 짧은 시간이지만 온전히 집중해서 장을 보거나 집안일을 할 수 있어서 좋았어요. 정말 3시간을 알차게 썼습니다. 진작에 알았더라면 워킹맘일때 어린 큰아이를 어린이집에 늦게까지 두지 않고 종종거리면서 퇴근하지 않았을텐데.. 내가 퇴근하는 시간까지 아이가 눈치보지 않고 집이나 근처 놀이터에서 돌봄선생님과 일대일로 놀았을텐데..하는 아쉬움이 많이 남습니다.하지만 단점이라면~불편한 점은 있어요. 제 개인적인 공간(집)에 오신다는게.....(이것도 금방 적응 됩니다~)​- 앞으로도 아이가 아플 때나(내아이가 아플 때면 주변 친인척(지인) 아이들도 아플 시기죠ㅠㅠ...)주말에 아이들이 참여하기 어려운 행사가 있거나 큰아이 또는 동생에게 온전히 신경을 써줘야 할때 등 다양한 이유로 우리가족이 필요로 할 때 연락할 수 있는 곳이 생겨서 기쁘고 든든합니다.​6. 미래의 직업ㅋ- 단기로 몇 시간만 할 수 있고 조건도 맞으면 내 여건에 맞게 구할 수 있다는게 좋은 점 인것 같아요.- 정부기관에서 하다보니 그 만큼 인성검사를 통과해야 하고 교육도 받지만 은퇴해서도 4대 보험되고 어떻게 보면 정년퇴임이 없다고 하고 이런저런 혜택이 많다고 합니다. (가족 중 관심을 가지는 분이 있어 물어봤습니다. )(매번 다양하게 질문하는데 즉각적이고 전문적인 설명을 해주시는 진천 아이돌봄센터 선생님 감사합니다.)​저에게 좋은 것들이 남에게는 좋으라는 법이 없어서 이글을 쓰기까지 많이 고민했어요. 괜히 썻다가 욕먹고 싶지 않아서요. 부디 자신의 상황에 맡게 골라서 정보를 얻으시길 바라며 센터에 문의해서 다시 한번 확인해주세요~​마지막으로 많은 도움이 되길 바랍니다.​​​",안녕하세요 저도 타지에 양가가 계시고 일을 시작해서 아이 아프거나 급할때 아이돌봄 이용하려하는데요 혹시 좋으셨던 선생님 추천좀해주실수있으실까요?
https://cafe.naver.com/q5q5q5?iframe_url=%2FArticleRead.nhn%3Fclubid%3D13536365%26articleid%3D718283%26art%3DaW50ZXJuYWwtY2FmZS13ZWItc2VjdGlvbi1zZWFyY2gtbGlzdA.eyJ0eXAiOiJKV1QiLCJhbGciOiJIUzI1NiJ9.eyJjYWZlVHlwZSI6IkNBRkVfVVJMIiwiYXJ0aWNsZUlkIjo3MTgyODMsImNhZmVVcmwiOiJxNXE1cTUiLCJpc3N1ZWRBdCI6MTc0NDM1ODM4MDgyOX0.R9Oyn_h-yP8FAry9QcJDzQZbOgAfz9nMfFFPN2CA8r0%26query%3D%25EC%2595%2584%25EC%259D%25B4%25EB%258F%258C%25EB%25B4%2584%25EC%2584%259C%25EB%25B9%2584%25EC%258A%25A4,"양천구, '밤샘 긴급돌봄 서비스' 연중 상시 운영","양천구(구청장 이기재)가 제도 정비를 통해 ‘아이 키우기 좋은’ 환경 만들기에 적극 나서고 있다.​양천구는 ‘양천형 밤샘 긴급돌봄 서비스’를 연중 상시 운영하기로 결정했다. 지난 2023년 양천구에서 전국 최초로 시작한 이 서비스는 맞벌이, 한부모 가정 등에서 부모가 출장, 야간 근무, 사고 등으로 아이를 돌볼 수 없는 긴급한 상황에 처했을 때 마음 놓고 아이를 맡길 수 있는 제도다.​12개월~6세 미만 영유아가 있는 가정이 대상이며, 지역 내 국공립 어린이집 22곳에서 오후 7시 30분부터 다음날 오전 7시 30분까지 아이를 맡길 수 있다. 당일 신청도 가능하며, 아동 한 명당 최대 월 80시간까지 이용할 수 있다. 보육료는 시간당 1000원으로 민간 서비스 보다 훨씬 저렴하다. 양천구는 향후 원장 관리수당을 신설하고 보육교사의 야간 수당과 운영비를 증액할 계획이라고 밝혔다.​보육 서비스의 중심인 보육 교직원의 처우개선에도 나선다. 올해부터 양천구 보육교사는 복리후생비, 장기근속수당 등을 지원받을 수 있다. 복리후생비는 그간 지원이 되지 않았던 국공립·법인, 서울형 어린이집 보육교사에게도 지급하고, 일반형(민간·가정) 보육교사 지원액은 월 7만원으로 상향하기로 했다. 또 민간·가정, 서울형 어린이집에만 지원되던 장기근속수당은 국공립, 법인(기타) 어린이집까지 지원을 확대하고, 보육교직원의 스트레스 완화를 위한 ‘힐링연수비’와 ‘생일격려금’ 등 각종 지원책을 마련한다는 계획이다.​이기재 양천구청장은 “돌봄에 대한 지원은 ‘행정의 책무’인 만큼 다양한 욕구를 반영한 맞춤형 복지서비스를 강화해 아이 키우기 좋은 도시를 만들어가겠다”고 말했다.",저번에도 남겼지만 이 프로그램이 잘 정착되면 너무 좋을 것 같은데 말이죠! 모두에게 좋은 방향이 되길 바랍니다~~
https://cafe.naver.com/imsanbu?iframe_url=%2FArticleRead.nhn%3Fclubid%3D10094499%26articleid%3D71566839%26art%3DaW50ZXJuYWwtY2FmZS13ZWItc2VjdGlvbi1zZWFyY2gtbGlzdA.eyJ0eXAiOiJKV1QiLCJhbGciOiJIUzI1NiJ9.eyJjYWZlVHlwZSI6IkNBRkVfVVJMIiwiYXJ0aWNsZUlkIjo3MTU2NjgzOSwiY2FmZVVybCI6Imltc2FuYnUiLCJpc3N1ZWRBdCI6MTc0NDM1ODM4MDgzMX0.F2ZFUeqAEKFq_yuVov0xCOvnfldjXovi5LWRhhsgzlg%26query%3D%25EC%2595%2584%25EC%259D%25B4%25EB%258F%258C%25EB%25B4%2584%25EC%2584%259C%25EB%25B9%2584%25EC%258A%25A4,아이돌봄서비스 1-2시간만 해도 될까요?,​안녕하세요~첫째 어린이집다니고 둘째 이제 100일을 향해가고있는데아이돌봄서비스는 100일이 지나야된다고 하더라구요?첫째가 하원하고 제일더운시간에도 굳이 놀이터에서 놀다가야된다고 떼쓰네요ㅠ둘째데리고 못나가겠어요...너무 더워요..하원시간에 맞춰 1-2시간만 아이돌봄서비스 이용 가능한가요? 하시는분 계시나요?보통 4-7시까지 하는것같은데 첫째가 낯가리기도하고 제가 좀 불편할것같아서요ㅠㅠ,가능하긴한데 돌봄쌤 구하기 어려울수도있어요1~2시간으로는 교통비도 안나올수있어서 근처사시는 돌봄쌤이 있지않는이상...ㅜㅜ
https://cafe.naver.com/imsanbu?iframe_url=%2FArticleRead.nhn%3Fclubid%3D10094499%26articleid%3D73342571%26art%3DaW50ZXJuYWwtY2FmZS13ZWItc2VjdGlvbi1zZWFyY2gtbGlzdA.eyJ0eXAiOiJKV1QiLCJhbGciOiJIUzI1NiJ9.eyJjYWZlVHlwZSI6IkNBRkVfVVJMIiwiYXJ0aWNsZUlkIjo3MzM0MjU3MSwiY2FmZVVybCI6Imltc2FuYnUiLCJpc3N1ZWRBdCI6MTc0NDM1ODM4MDgzNH0.Jr55ffMPsMTrpUxBOxw3Zj5j1OuLOX5Q4lzbkJILnl8%26query%3D%25EC%2595%2584%25EC%259D%25B4%25EB%258F%258C%25EB%25B4%2584%25EC%2584%259C%25EB%25B9%2584%25EC%258A%25A4,아이돌봄서비스 종일제와 부모급여 문의드려요,현재 만 0세라 부모급여가 100만원이 나오는데요​아이돌봄 서비스 이용 금액이 100만원을 초과할 경우100만원은 부모급여에서 차감되고 차액은 본인이 부담하는 걸까요? 아님 추가부담금은 없을까요?​반대로 종일제로 월30만원만 이용했을 경우에는차액인70만원은 돌려받을 수 있나요?,"부모급여로 아이돌봄 비용 결제가 되나요~? 부모급여 100 들어오고, 아이돌봄 120나오면 알아서 120 결제하고 이런거로 인지하고있었는데.. 참고로 추가금 나오면 당연히 추가금은 결제됩니다~"
https://cafe.naver.com/imsanbu?iframe_url=%2FArticleRead.nhn%3Fclubid%3D10094499%26articleid%3D74572060%26art%3DaW50ZXJuYWwtY2FmZS13ZWItc2VjdGlvbi1zZWFyY2gtbGlzdA.eyJ0eXAiOiJKV1QiLCJhbGciOiJIUzI1NiJ9.eyJjYWZlVHlwZSI6IkNBRkVfVVJMIiwiYXJ0aWNsZUlkIjo3NDU3MjA2MCwiY2FmZVVybCI6Imltc2FuYnUiLCJpc3N1ZWRBdCI6MTc0NDM1ODM4MDgzNn0.6GCtTXLlfy7QKAU2g2SagHJle3mOsuIdBeGdzOk6LbY%26query%3D%25EC%2595%2584%25EC%259D%25B4%25EB%258F%258C%25EB%25B4%2584%25EC%2584%259C%25EB%25B9%2584%25EC%258A%25A4,"8월복직이라, 아이돌봄서비스 이용하고싶은데요.","복직8월. 아기는 그때가 12개월이에요.어린이집을 보내긴 너무 빠른거같아서,돌봄이용하려고하는데,​그 8월에 바로 이용이 가능한가요?신청은 주민센타가면 바로 해주나요?지금은 육아휴직중이에요.6살4살 6개월아기 ㅡ 애셋입니다.​",신청해두면 대기만6개월이상이라는데신청해봐야아는거고지원안받고 자비 부담100프로로해서당근에 시터구하는게 빠르더라구요
https://cafe.naver.com/imsanbu?iframe_url=%2FArticleRead.nhn%3Fclubid%3D10094499%26articleid%3D69068301%26art%3DaW50ZXJuYWwtY2FmZS13ZWItc2VjdGlvbi1zZWFyY2gtbGlzdA.eyJ0eXAiOiJKV1QiLCJhbGciOiJIUzI1NiJ9.eyJjYWZlVHlwZSI6IkNBRkVfVVJMIiwiYXJ0aWNsZUlkIjo2OTA2ODMwMSwiY2FmZVVybCI6Imltc2FuYnUiLCJpc3N1ZWRBdCI6MTc0NDM1ODM4MDgzOH0.KN8WQDdf0fCMdaLq2Wc3ZpdQSYt7k_xTxyvMlJ-UvYM%26query%3D%25EC%2595%2584%25EC%259D%25B4%25EB%258F%258C%25EB%25B4%2584%25EC%2584%259C%25EB%25B9%2584%25EC%258A%25A4,아이돌봄서비스 관련질문,안녕하세요 44일된 남매둥이 키우는맘이에요이제 다음주면 산후도우미 기간이끝나서 아이돌봄서비스를 알아보는중인데 지금 시댁에서 지내는중이인데 원래집(등본상거주지)은 서울 성북구고 시댁은 서울 관악구에요 혹시 아이돌봄서비스는 등본상 거주지인곳에서만 가능할까요??아님 거주지는 상관 없을까요?그리고 어린이집 신청하는것도 등본상 거주지인곳에서만 신청하고 다닐수 있는건가요? 헉시 아시는분 있으면 답해주시면 감사하겠습니다!,어린이집은 타지역에서도 신청 가능해요.  이사 오기전에 미리 신청해서 이사와 동시에 옮기더라구요.
